,inputs,targets
462,มะยงชิดต่างจากมะปรางอย่างไร," สีของผล: มะยงชิดสุกแล้วจะมีสีเหลืองอมส้มและมีสีเข้มกว่ามะปราง ขณะที่มะปรางจะมีสีเหลืองอ่อน ๆ"
463,"ปรากฏการณ์ทางธรรมชาติที่เรียกว่า ""ปลากอง"" คืออะไร",เป็นปรากฏการณ์ที่ปลาปีกแดงจำนวนมากตัวมารวมกัน ในบริเวณแหล่งน้ำธรรมชาติ เพื่อผสมพันธุ์วางไข่ในห้วงเดือนพฤศจิกายน ถึงเมษายน ของทุกปี ช่วงเวลาที่เกิดปรากฏการณ์ของปลากองจะเกิดขึ้นตรงกับวันพระ ขึ้น 14 และ 15 ค่ำ ตั้งแต่เวลา สองทุ่ม ถึง หกโมงเช้า หลังจากที่ปลาขึ้นมาผสมพันธุ์วางไข่แล้วจะกลับอาศัยที่เดิม บางตัวตายตามอายุไข ปลากองเป็นพฤติกรรมของปลาปีกแดง ที่ใน 1 ปี ในช่วงเดือนกุมภาพันธ์ หรือ มีนาคม จะพากันว่ายทวนน้ำมาผสมพันธุ์  วางไข่ตามลำน้ำ  โขดหิน ในลำน้ำมาง ลำน้ำว้า ที่เป็นสาขาของแม่น้ำน่าน โดยมีความโดดเด่นคือ จะพากันมาเป็นฝูงนับหมื่นนับแสนตัว ขึ้นอยู่กับความสมบูรณ์ของแหล่งน้ำ ซึ่งนับว่าเป็นปรากฎการณ์ที่พบยาก ที่พบแห่งเดียวในประเทศไทย ของอำเภอบ่อเกลือ จังหวัดน่าน
464,ปลาแซลมอนกับปลาเทราต์แตกต่างกันอย่างไร," ขนาดตัวปลา: แซลมอนลำตัวเรียวยาวกว่าเทราต์"
465,โปงลางเป็นเครื่องดนตรีของภาคอะไร,ภาคตะวันออกเฉียงเหนือ ประเทศไทย
466,การท้องลูกแฝดเกิดจากอะไร,"ครรภ์แฝดแบ่งออกเป็น 2 ชนิด คือ แฝดแท้และแฝดเทียม"
467,หาดลูกแก้วอยู่ที่ไหนและเกิดจากอะไร,หาดลูกแก้ว Glass Beach  เป็นชายหาดอยู่ในอุทยานแห่งรัฐแมคเคอร์ริเชอร์  MacKerricher State Park  ใกล้ฟอร์ตแบรกก์ รัฐแคลิฟอร์เนีย สหรัฐอเมริกา เกิดขึ้นจากกองขยะ เศษแก้ว ต่าง ๆ ที่ถูกทิ้งจากเมือง แล้วถูกทะเลกัดเซาะจนกลายเป็นลูกแก้ว
468,ยาเสพติดส่งผลกระทบต่อประเทศอย่างไร,บ่อนทำลายเศรษฐกิจ และความมั่นคงของประเทศชาติ รัฐบาลต้องสูญเสียกำลังเจ้าหน้าที่และค่าใช้จ่ายในการป้องกันปราบปรามและรักษาผู้ติดยาเสพติดจำนวนมาก สูญเสียทรัพยากรมนุษย์ที่มีคุณภาพสำหรับการพัฒนาประเทศ เพิ่มภาระการเสียภาษีของประชาชน เพราะรัฐบาลต้องนำภาษีของประชาชนไปใช้จ่ายในการแก้ไขปัญหายาเสพติด
469,ขอรายชื่ออำเภอในจังหวัดสุโขทัย,อำเภอเมืองสุโขทัย อำเภอคีรีมาศ อำเภอกงไกรลาศ อำเภอบ้านด่านลานหอย อำเภอศรีสำโรง อำเภอสวรรคโลก อำเภอศรีสัชนาลัย อำเภอทุ่งเสลี่ยม และอำเภอศรีนคร
470,ทำไมคนไทยเรียกบะหมี่สำเร็จรูปว่ามาม่า,เพราะความเคยชินและการตลาดของมาม่า มาม่าไม่ใช่แบรนด์บะหมี่สำเร็จรูปที่เข้ามาในประเทศไทย มาม่าจึงทำบะหมี่สำเร็จรูปรสชาติต่าง ๆ ที่ถูกใจคนไทยกับการตลาด จึงทำให้คนไทยเรียกบะหมี่สำเร็จรูปว่ามาม่า
471,มือถือสามารถถ่ายภาพดวงดาวบนท้องฟ้ายามค่ำคืนได้หรือไม่,ได้ มือถือสามารถถ่ายภาพดวงดาวบนท้องฟ้าได้ โดยปรับค่า ISO ให้ต่ำ ๆ แล้วตั้งเวลาถ่ายภาพนาน ๆ เพียงเท่านี้คุณสามารถถ่ายภาพดวงดาวบนท้องฟ้า เช่น ทางช้างเผือก ได้ เป็นต้น
472,หมาล่ามาจากประเทศอะไร,ประเทศจีน
473,ชาบูคืออะไร,ชาบูเป็นอาหารญี่ปุ่นประเภทหม้อไฟแบบหนึ่ง คล้ายกับสุกี้ยากี้ มีส่วนผสมต่าง ๆ เช่น ผัก เนื้อหั่นบาง ๆ และอาหารทะเล โดยการปรุงจะนำวัตถุต่าง ๆ เหล่านี้จุ่มแช่ลงในน้ำเดือด หรือน้ำซุป และปล่อยทิ้งไว้สักพัก จากนั้นนำส่วนผสมอย่างอื่น เช่น เต้าหู้ บะหมี่ ลงตุ๋นให้เข้ากัน แล้วรับประทานโดยจุ่มลงในซอส
474,มุข valve ไม่เคยนับถึง 3 มาจากเหตุใด,"มาจากบริษัท valve ที่ทำเกม HalfLife 2, DOTA 2, Portal 2 และอื่น ๆ โดยไม่ขึ้นเลข 3 ไม่พัฒนาเกมภาคต่อ แถมมีข่าวหลุดมาเรื่อย ๆ แต่ล้วนเป็นข่าวปลอม และผู้ก่อตั้งบริษัทไม่เคยยืนยันเกมภาคต่อภาค 3 จึงกลายเป็นมุข   valve ไม่เคยนับถึง 3"
475,Batman มีบุคลิกอย่างไร,Batman เป็นตัวละครที่มีหลายบุคลิก สะท้อนการเข้าสังคมของมนุษย์ที่ทุกคนต่างมีหน้ากากหลายด้านในการเข้าสังคม สำหรับ Batman มีสองบุคลิก คือ บรูซ เวย์น เป็นมหาเศรษฐี กับ Batman ผู้ผดุงความยุติธรรม
476,ปลาบึกพบได้ที่ไหน,แม่น้ำโขงตั้งแต่ประเทศสาธารณรัฐประชาชนจีนลงมาจนถึงเมียนมา ลาว ไทย กัมพูชา และเวียดนามตอนใต้
477,เอาปลาบึกไปทำอาหารอะไรได้บ้าง," ต้มยำปลาบึก"
478,ข้าวเหนียวหมูปิ้งแบบดั้งเดิมเป็นแบบไหน,หมูปิ้งมีมันหมูที่แทรกระหว่างเนื้อหมู นิยมใส่เครื่องปรุงตามสูตรของแต่ละคน เช่น กระเทียม พริกไทย ผงปรุงรส และซอสหอยนางรม เมื่อเตรียมเสร็จแล้ว หมูปิ้งโบราณจะถูกนำมาย่างบนเตาถ่าน ทำให้มีกลิ่นหอม รสชาติเข้มข้น ทานคู่กับข้าวเหนียวร้อน ๆ สูตรหมูปิ้งโบราณ
479,ปัจจุบันปลากระโห้พบได้ที่ไหน,แม่กลองและแม่โขง
480,ปลากระโห้เคยมีในแม่น้ำเจ้าพะยาจริงหรือไม่,จริง เคยมีปลากระโห้ในแม่น้ำเจ้าพะยา แต่ปัจจุบันได้สูญหายไปจากแม่น้ำเจ้าพระยาแล้ว
481,มีวิธีอบอุ่นร่างกายในหน้าหนาวอย่างไรบ้าง,"1. สวมเสื้อผ้าหนาๆ"
482,การจามเกิดจากอะไร,เกิดจากสิ่งแปลกปลอมเข้าไปภายในโพรงจมูก ทำให้เกิดการระคายเคืองบริเวณเยื่อบุโพรงจมูกจากนั้นจามออกมา
483,หลักกิโลเมตรใช้ทำอะไร,เป็นตัวบอกระยะทางของจุดหมายปลายทางที่เราจะไป ว่ามีระยะทางเท่าไรอีกกี่กิโลเมตรจึงจะถึงจุดหมาย และยังบอกตำแหน่งว่าเรากำลังอยู่ที่ไหนด้วย
484,พัสดุส่งมาผิดบ้านทำอย่างไรดี,แนะนำให้ติดต่อขนส่งที่ส่งพัสดุเพื่อทำการคืนพัสดุให้ไปส่งให้ถูกบ้าน
485,EECi อยู่ที่ไหน,อยู่ที่ วังจันทร์วัลเลย์ ตำป่ายุบใน อำเภอวังจันทร์ จังหวัดระยอง
486,อิสราเอลส่งออกอะไรมาประเทศไทยมากที่สุด,"สินค้าที่ไทยนำเข้าจากอิสราเอลมากที่สุด ช่วงเดือน ม.ค.ส.ค. 66 คือ เครื่องเพชรพลอย อัญมณี เงินแท่งและทองคำ 4,121.91 ล้านบาท คิดเป็นสัดส่วน 38.43%"
487,รถไฟฟ้าความเร็วสูงสายแรกของไทยมีแผนจะเปิดดำเนินการเมื่อไร,มีกำหนดการแล้วเสร็จในปี พ.ศ.2569
488,อาการละเมอเกิดขึ้นได้อย่างไร,เกิดขึ้นจากการนอนหลับที่ไม่เพียงพอ ความเครียดและความวิตกกังวล
489,แม่คะนิ้งเกิดขึ้นที่ไหนและเกิดได้อย่างไร,เกิดขึ้นบริเวณยอดหญ้า ส่วนใหญ่เกิดบนดอยทางภาคเหนือของไทย โดยเกิดจากอากาศมีความชื้นสูง เมื่ออุณหภูมิลดต่ำลงกว่าจุดเยือกแข็ง freezing point  ไอน้ำในอากาศเปลี่ยนเป็นผลึกน้ำแข็งหรือเกล็ดน้ำแข็งเกาะอยู่บนใบไม้ใบหญ้า เรียกว่า แม่คะนิ้งหรือเหมยขาบ
490,แนะนำขั้นตอนส่งจดหมายผ่านไปรษณีย์ให้หน่อย,"1. เขียนจดหมายด้วยกระดาษเอ 4 แล้วพับให้พอดีกับซองจดหมาย"
491,โลกิ เทพนอร์สถูกรู้จักในนามอะไร,เทพเจ้าผู้หลอกลวง
492,ลืมกุญแจเข้าห้องในหอพักทำอย่างไรดี,ติดต่อเจ้าของหรือเจ้าหน้าที่หอพัก เพื่อขอกุญแจหลักสำหรับเข้าห้องที่หอพักไปเอากุญแจที่อยู่ในห้องพัก
493,กลัวทำกุญแจหายหรือลืมไว้ในห้อง ทำอย่างไรดี,แนะนำให้เก็บกูญแจไว้ให้เป็นที่ พยายามอย่าเก็บกุญแจไว้ที่ใหม่ และทำกุญแจสำรองเก็บไว้ เผื่อกรณีลืมกูญแจหลักไว้ที่ห้องจะได้ยังสามารถเข้าห้องได้
494,การเขียนบันทึกประจำวันมีข้อดีอย่างไรบ้าง,ช่วยบันทึกเรื่องราวในชีวิต เสริมสร้างความจำให้สามารถจดจำได้นานยิ่งขึ้นและยังได้ฝึกพัฒนาทักษะการเขียนไปในตัว
495,การทำบันทึกรายรับรายจ่ายมีผลต่อการบริหารจัดการเงินอย่างไร,ช่วยให้เราสามารถเห็นรายการเงินได้กับรายจ่าย เพื่อช่วยให้ปรับพฤติกรรมการใช้เงินได้
496,หากหิมะตกในประเทศไทยควรรับมืออย่างไรบ้าง,ให้รีบหลบเข้าบ้าน พยายามสร้างความอบอุ่นให้ร่างกาย เสื้อผ้าหนา ๆ ปิดประตูหน้าต่างทุกบานเพื่อไม่ให้หิมะกับลมหนาวเข้ามาในบ้าน นำสัตว์เลี้ยงเข้ามาบ้าน พยายามอย่าออกจากบ้านโดยไม่ใส่เสื้อผ้าหนา ๆ อย่ากินหิมะ เพราะหิมะไม่ได้สะอาดอย่างที่คิด
497,ทำไมภาคใต้ของไทยถึงไม่มีฤดูหนาว,เพราะลมมรสุมตะวันออกเฉียงเหนือที่พัดเข้าภาคใต้ดันพัดผ่านทะเลก่อนจะขึ้นฝั่ง เลยทำให้เกิดฝนตกบนบกแทนที่จะเป็นลมหนาว
498,ทำไมต้องล้างตัวก่อนลงสระว่ายน้ำ,เพื่อชะล้างสิ่งสกปรกที่ติดตามร่างกาย ก่อนลงสระเบื้องต้น
499,เราสามารถฝึกกีฬาโต้คลื่นได้ที่ไหนบ้างในประเทศไทย,"1. หาดแหลมปะการัง จ.พังงา"
500,เพลงคลาสสิกเป็นฉันใด ,เพลงคลาสสิกเป็นเพลงที่ถูกบรรเลงด้วยเครื่องเล่นเพลงตะวันตก โดยสื่อ ความรู้สึกของผู้ประพันธ์ มาทางบทเพลง
501,ประเพณีรับน้องขึ้นดอยเป็นของที่ไหนและจัดขึ้นเพื่ออะไร,เป็นของมหาวิทยาลัยเชียงใหม่ จัดขึ้นเพื่อสร้างเสริมความสามัคคีกันในหมู่นักศึกษาและนมัสการพระบรมธาตุดอยสุเทพ
502,ทำไมคนนิยมหากบหลังฝนตก,เพราะกบออกมาร้องหาคู่ ออกจากรูออกมาส่งเสียงหาคู่ จึงเป็นช่วงเวลาเหมาะสมสำหรับหากบ
503,เกิดอะไรขึ้นกับตั๊กแตนปาทังก้าที่เคยระบาดในประเทศไทย,จากการระบาดตั๊กแตนปาทังก้าเมื่อปี พ.ศ.2525  พ.ศ.2530 สร้างความเสียดายให้กับพื้นที่การเกษตรของไทย คนไทยจึงจับตั๊กแตนปาทังก้านำไปขายกับบริโภคเป็นอาหารว่างหรือกับแกล้มรสโอชะ โปรตีนสูงกับน้ำพริกและซอส นอกจากนั้น ชาวบ้านพากันไปขุดเอาไข่หรือตัวอ่อนตั๊กแตนกับไข่ตั๊กแตนที่ฝังอยู่ใต้ดินมาขายต่อ ซึ่งได้ราคาสูงกว่ามาก ด้วยเหตุเหล่านี้ทำให้ตั๊กแตนปาทังก้าหยุดการระบาดในประเทศไทยและหายไปจากประเทศไทย แต่คนไทยบางส่วนยังนำเข้าตั๊กแตนปาทังก้าจากเพื่อนบ้าน เพื่อมาบริโภคกันอยู่ในปัจจุบัน
504,มีวิธีป้องกันสิวแนะนำไหม,แนะนำให้ออกกำลังกาย อย่าพยายามเครียด ล้างหน้าให้ถูกวิธี พักผ่อนให้เพียงพอ
505,ปลาบึกใกล้สูญพันธุ์เพราะด้วยเหตุใด,เพราะการสร้างเขื่อนกั้นแม่น้ำและระเบิดเกาะแก่งแม่น้ำโขงส่งผลกระทบต่อระบบนิเวศแม่น้ำโขงตอนกลางและตอนปลาย ระดับน้ำไม่สม่ำเสมอ นอกจากนั้นยังมีปัญหาการจับปลาบึกในช่วงฤดูวางไข่
506,สะพานลอยข้ามเส้นทางสัญจรทางบกแห่งแรกในประเทศไทยชื่อว่าอะไรและสร้างเมื่อปีไหน,สะพานลอยข้ามเส้นทางสัญจรทางบกแห่งแรกในประเทศไทยชื่อว่า “สะพานกษัตริย์ศึก” สร้างขึ้นเมื่อปี พ.ศ. 2471 เพื่อข้ามทางรถไฟเส้นทางรถไฟจากสถานีรถไฟหัวลำโพงทางถนนพระรามที่ 1
507,ข้าวนาปรังมีต้นทุนกับกำไรอย่างไรบ้าง,"จากข้อมูลปี พ.ศ.2565 ข้าวนาปรัง มีต้นทุนการผลิต 4,367.18 บาท/ไร่/รอบการผลิต ผลตอบแทนเฉลี่ย 4,502.25 บาท/ไร่/รอบการผลิต ผลตอบเฉลี่ยสุทธิ กำไร  135.07 บาท/ไร่/รอบการผลิต"
508,เจตจำนงเสรีมีจริงหรือไม่,ปัจจุบันนักวิชาการหลายสาขายังคงถกเถียงกันประเด็นว่า เจตจำนงเสรี free will  มีจริงหรือไม่ และ มนุษย์มีเจตจำนงเสรีหรือไม่ นักวิทยาศาสตร์ค้นพบว่าการตัดสินใจของมนุษย์มาจากสมองล่วงหน้าไม่กี่วินาที ดังนั้น มนุษย์มีเจตจำนงเสรีหรือไม่ ยังคงเป็นที่ถกกันอยู่ในปัจจุบัน
509,มือถือ Nokia N9 ใช้ระบบปฏิบัติการอะไร,ใช้ระบบปฏิบัติการ MeeGo ที่ทำงานด้วยลินุกซ์
510,แตงโมมีต้นทุนการผลิตและผลตอบแทนเท่าไร,"ตามข้อมูลปี พ.ศ.2566 แตงโม ต้นทุนการผลิต 13,381.64 บาท/ไร่/รอบการผลิต ให้ผลผลิต 2,210.00 กิโลกรัม/ไร่/รอบการผลิต ผลตอบแทนเฉลี่ย 15,470.00 บาท/ไร่/รอบการผลิต ผลตอบแทนเฉลี่ยสุทธิ กำไร  2,088.36 บาท/ไร่/รอบการผลิต"
511,ข้าวโพดหวานมีต้นทุนการผลิตและผลตอบแทนเท่าไร,"ตามข้อมูลปี พ.ศ.2566 ข้าวโพดหวาน ต้นทุนการผลิต 5,568.05 บาท/ไร่/รอบการผลิต ให้ผลตอบแทน 1,000 กิโลกรัม/ไร่/รอบการผลิต ผลตอบแทนเฉลี่ย 6,500 บาท/ไร่/รอบการผลิต ผลตอบแทนเฉลี่ยสุทธิ กำไร  931.95 บาท/ไร่/รอบการผลิต "
512,ถั่วเขียวมีต้นทุนการผลิตและผลตอบแทนเท่าไร,"ตามข้อมูลปี พ.ศ.2566 ถั่วเขียว ต้นทุนการผลิต 3,234.34 บาท/ไร่/รอบการผลิต ให้ผลผลิต 120.00 กิโลกรัม/ไร่/รอบการผลิต ผลตอบแทนเฉลี่ย 4,200 บาท/ไร่/รอบการผลิต ผลตอบแทนเฉลี่ยสุทธิ กำไร  965.66 บาท/ไร่/รอบการผลิต"
