,inputs,targets
951,ทำไมคนอิสลามไม่กินเนื้อหมู,ไม่ใช่ไม่รับประทานแต่สุกร สัตว์อื่นๆ ที่เชือดไม่ถูกวิธีก็ไม่ทาน เลือดก็ไม่ทาน เป็นบัญญัติทางศาสนา ซึ่งอาจมีเหตุมาแต่อดีตกาล อนึ่งศาสนาอิสลามและศาสนาคริสต์มีต้นกำหนดเดียวกันจากศาสนายูดา มีคัมภีร์ร่วมกันคือ Hebrew Bible
953,คำว่ากลับบ้านความหมายคือ,กลับ เป็นคำกริยาหมายถึง ตรงกันข้ามกับภาวะเดิมหรือทิศทางเดิม กลับบ้าน = เดินทางกลับบ้าน ย้อนกลับบ้าน ย้อนคืนสู่บ้าน
954,สุนัขของในหลวงราชาศัพท์เรียกว่าอะไร,สุนัขทรงเลี้ยง ในรัชการ ร.9 มีคุณทองแดงเป็นอาทิ ในรัชกาลก่อนมีย่าเหลเป็นตัวอย่างสำคัญ
956,ฉุดคิดหรือฉุกคิดคำไหนถูกต้อง,"ฉุกคิด ก. คิดขึ้นมาทันที, คิดได้ในขณะนั้น, บังเอิญคิดได้"
957,จวก ในภาษาพาดหัวข่าวการเมืองแปลว่าอะไร,จากพจนานุกรมคำใหม่ จวก คือ ว่าร้ายด้วยวาจา ว่าหรือตำหนิอย่างรุนแรง เช่น รัฐมนตรีคนนั้นโดนฝ่ายค้านรุมจวกยับ
958,คำสแลงกับคำแสลงแตกต่างกันอย่างไร,"เนื่องจากทับศัพท์มาจากคำว่า slang จึงน่าจะเขียนเป็น คำสแลง ไม่ได้เขียนว่าคำแสลง [สะแหฺลง] คำที่แสลงหู อาจใช้คำอื่นเรียกแทน เช่น คำหยาบ คำไม่สุภาพ เป็นต้น "
960,อยากรู้คำที่ยืมมาจากภาษาต่างประเทศมีประเทศไหนบ้างและมีคำว่าอะไรบ้าง... ,สำหรับภาษาไทย มีการยืมคำมาจากหลายๆ ภาษา แทบทุกภาษา  โดยเฉพาะภาษาอังกฤษ คำที่มาจากภาษาอังกฤษ ที่คุ้นเคยในปัจจุบันนี้ก็มักจะเป็นคำที่ใช้กันในสมัยปัจจุบัน สมัยก่อนยังไม่มีการใช้มากนักหรือไม่มีเลย  เช่นคำว่า ฟุตบอล คอมพิวเตอร์ อินเทอร์เน็ต ฯลฯ หรืออาจสับสนกับบางคำที่นิยมทับศัพท์กันบ่อยๆ แต่ยังไม่ใช่คำในภาษาไทย เช่น คิล เลิฟ พอยต์ อันโนน ฯลฯ พวกนี้ ยังไม่นับว่ายืมมาจากภาษาอื่นจริง  และ ภาษาของประเทศเพื่อนบ้านและประเทศใกล้เคียงในทวีปเอเชีย เช่น ภาษาเขมร ภาษาบาลี ภาษาสันสกฤต ภาษาจีน ฯลฯ ภาษาอื่นในทวีปยุโรปก็มี แต่มีเพียงน้อยคำ สำหรับชื่อเฉพาะ เช่น ไฮไฟฟ์ กูเกิล ยูทูบ ฯลฯ พวกนี้ก็ไม่ถือว่ายืมเช่นกัน 
961,คำว่า lol แปลว่าอะไร,"LOL หรือ lol ย่อมาจาก ""laughing out loud"" หรือ ""laugh out loud"" หัวเราะเสียงดัง "
962,คำว่าเฟสติวอลสภาษาอังกฤษเขียนอย่างไร,คุณอาจจะหมายความถึง คำว่า festival เอกพจน์  หรือ festivals พหูพจน์  เป็นเพียงการพยายามตีความ เฟสติวอลส ที่คุณเขียนมา ซึ่งอาจจะไม่ใช่คำนี้ก็ได้
965,นกกระดาษนี้เมื่อพับครบ9999ดวงจะมีปาฏิหาริย์จริงหรือ,"เป็นเพียงความเชื่อเท่านั้น สรุปคือ"
966,อยากรู้อ่ะครับว่าภาษาเนี่ย ตัวเลขมันเขียนยังไงบ้างใครรู้ช่วยหน่อย," cero uno dos tres cuatro cinco seis siete ocho nueve diez once doce 012 "
967,หาตัวอักษรธรรมล้านนาแต๊ๆได้ที่ไหน,"อักษรธรรมล้านนามีหลายประเภท แบ่งได้ใหญ่ๆ 3 ประเภท คือ 1 อักษรล้านนา ตั๋วเมือง  ใช้สำหรับ เขียนบทความทั่วไปในชีวิตประจำวัน 2 อักษรธรรมล้านนาขอม ลักษณะคล้ายอักษรเขมร ในสมัยโบราณมักเติมศก เป็นเส้นขีดหยักๆใช้สำหรับ เขียนโคลง วรรณกรรม ต่างๆ ที่ ไม่ใช่ของล้านนาอย่างแท้จริง 3 อักษรธรรมล้านนา เป็นลักษณะเดียวกับ อักษรล้านนา แตกต่างกันบางพื้นที่ แต่ไม่มาก แล้ว ใช้ ตัวเลข เป็น เลขในธรรม ใช้สำหรับเขียน ธรรม โคลง ค่าว หรือ วรรณกรรมพื้นเมือง รวมไปถึง คาถาสวดถอนพื้นเมืองและ ธรรมบาลีอีกด้วย"
968,อักขระวิธีขอมไทยและ/หรือขอมบาลี มีการใช้ สะ สองห้อง ไหม,มีการใช้ทั้งสองห้อง และมีการใช้ผสมผสานกัน
969,การทำบุญ ไหว้พระ ตักบาตร สำหรับผู้หญิงห้ามทำในวันที่มีประจำเดือนจริงหรือเปล่า,ไม่ทราบว่า คุณไปเอาความเชื่อเหล่านี้มาจากแหล่งใด ขอเดาว่า สมัยก่อนไม่มีผ้าอนามัยเหมือนในปัจจุบัน การที่มีเลือดไหล โดยไม่ได้เจตนาดังเช่นในกรณีดังกล่าว  ในขณะที่ทำบุญทางศาสนา อาจถูกมองในแง่ลบ เช่น มองในแง่ของความเชื่อ ว่าเป็นความไม่มงคล  เป็นต้น ก็เป็นได้ เลยมีคนที่กล่าวเช่นนั้น ส่วนความเชื่ออื่น ๆ ที่ไม่เกี่ยวกับทางศาสนาแต่เกี่ยวกับประจำเดือน ก็ยังพอมีเหลืออยู่บ้าง ซึ่งในปัจจุบัน บางความเชื่อ ที่ไม่เกี่ยวกับทางศาสนา  ดังกล่าว ก็มีการพิสูจน์ได้ว่า หรือถือได้ว่า  ไม่เป็นความจริง
970,เฉาฉุยแปลว่าอะไร,เป็นภาษาจีนแต้จิ๋ว แปลว่าปากเสีย เฉา=เหม็นเน่า 
972,ราคาพาร์หมายถึงอะไร,PAR value แปลเป็นไทยคือราคาหน้าตั๋ว ตอน initial offering หรือการซื้อขาย เสนอขาย ต่อประชาชน  ครั้งแรก ราคามันมักจะอยู่ที่พาร์ แต่พอบริษัทห้างร้านดำเนินกิจการไป มีกำไรขาดทุนโอกาส... ราคาซื้อขายของตราสารทุน หรือหนี้  ดังกล่าวจึงเป็นไปตามอุปกสงค์อุปกทานของตลาด
973,เผด็จการรัฐสภาหมายถึงอะไร,คือการที่ใรสักคนสามารถรวบอำนาจในรัฐสภาเอาไว้ได้ทั้งหมด และใช้อำนาจที่มีในลักษณะเผด็จการผ่านสภาผู้แทน
974,สิทธิ ต่างจาก สิทธิ์ อย่างไร,"พจนานุกรม ฉบับราชบัณฑิตยสถาน พ.ศ. 2542 ระบุว่าการรับรองจากกฎหมาย. อ. right . ตอบ มีความหมายเหมือนกัน เป็นคำนามเหมือนกัน อาจจะขึ้นกับความเหมาะสม หรือขึ้นกับลักษณะของประโยคเสียมากกว่าว่าจะใช้คำใด"
976,อยากรู้ว่า คำว่า นกกระดาษ ใช้ภาษาอังกฤษว่าอะไร ไม่เอา nok kra dad นะคะ >< แบบอังกฤษเลย หรือว่าใช้เป็นภาษาอังกฤษของคำว่านกกระเรียน ช่วยตอบด้วยนะคะ จำเป็นจริงๆเลยล่ะคะ ขอบพระคุณคะ,เรียกว่า origami crane คำว่า crane มีอีกความหมายคือนกกระเรียน
977,คำว่า สรรค์สร้าง เขียนแบบนี้หรือปล่าวครับ ข้อความว่า พวกเรา สรรค์สร้าง ความดี,"ถูกแล้ว ""สรรค์"" แปลว่า สร้าง, ""สรรค์สร้าง"" เป็นคำซ้อน คือ ทั้งสองคำมีความหมายคล้ายกัน นำมาใช้ร่วมกัน, ส่วน ""สรร"" คำนี้แปลว่า เลือก, หา"
978,ข้อใดเป็นพยางค์เพียงอย่างเดียว 1.นิ 2.ดู 3.โต 4.จะ,ไม่มีคำตอบสำหรับข้อนี้ เพราะทุกข้อล้วนเป็นพยางค์ตามหลักภาษาไทย แต่มีเพียงข้อ 1 ที่ไม่เป็นคำ
979,ปปช. ย่อมาจากอะไร,คณะกรรมการป้องกันและปราบปรามการทุจริตแห่งชาติ
980,ลักษณะของผู้นำที่ดีเป็นอย่างไร,"มีหลักอยู่ห้าข้อ"
981,ศรีนครินทรวิโรฒ อ่านว่าอย่างไร,"จากบทความมหาวิทยาลัยศรีนครินทรวิโรฒ: มีความหมายว่า ""มหาวิทยาลัยที่เจริญเป็นศรีสง่าแก่มหานคร"" ""วิโรฒ"" มาจากคำว่า ""วิโรฒ"" ในภาษาสันสกฤต แปลว่า ความงอกงามหรือเจริญ มหาวิทยาลัยศรีนครินทรวิโรฒ อ่านว่า สีนะคะรินวิโรด  มีชื่อย่อ ว่า ""มศว"" ไม่มีจุด  เขียนเป็นภาษาอังกฤษว่า ""Srinakharinwirot University"""
982,การเพาะเห็ดฟางใช้งบประมาณมากไหม,คำว่ามากน้อยเป็นเรื่องอัตวิสัยตอบไม่ได้ การเพาะเห็ดฟางนั้น ถ้าทำเล่นๆ ในบ้านค่าใช้จ่ายเริ่มที่หลักร้อยบาท ต้องใช้วัสดุและอุปกรณ์ที่มีอยู่เดิมด้วย แต่ถ้าจะซื้อหาทุกสิ่งมาก็คงถึงหลักพันบาท
984,มีแฟนชาวต่างชาติอยากรู้ว่าเราสามารถเอาชื่อแฟนเข้าในทะเบียนบ้านได้หรือไม่หรือมีวิธีไหนที่สามารถทำได้,ต้องโอนเป็นสัญชาติไทยเสียก่อน และต้องย้ายมาอาศัยอยู่ในไทย ตามทะเบียนบ้าน 
985,ประชาชนจะได้รับประโยชน์อะไรจากบริษัทหลักทรัพย์ และธุรกิจจะได้รับประโยชน์อะไรจากบริษัทหลักทรัพย์,บริษัทหลักทรัพย์เป็นนายหน้าค้าหลักทรัพย์ ประชาชนได้รับบริการจากบริษัทหลักทรัพย์เพื่อให้ได้มาซึ่งหลักทรัพย์ที่ต้องการโดยสะดวก ไม่ต้องไปซื้อจากกลุ่มธุรกิจโดยตรง ธุรกิจก็ได้ใช้บริษัทหลักทรัพย์และ/หรือตลาดหลักทรัพย์เป็นช่องทางระดมทุนมาดำเนินกิจการ
986,เรียนจบ ป ตรีแล้วอยากเรียนวุฒิครู ทำอย่าวไรค่ะ เรียนที่ไหน,ลองใช้วุฒิ ป.ตรี สมัครเข้า คณะครุศาสตร์ ของมหาวิทยาลัยเปิดหรือราชภัฏ หลักสูตร 2 ปีต่อเนื่อง
987,อยากทราบว่าศิลปะคืออะไร สำคัญอย่างไร ช่วยแนะนำหน่อย,ตามนิยามที่สอนในมหาวิทยาลัย ศิลปะ คือ ความงามที่เกิดขึ้นจากฝีมือมนุษย์ ส่วนลวดลายที่สวยงามที่เกิดขึ้นเองตามธรรมชาติยังไม่ถือว่าเป็นศิลปะ จนกว่ามนุษย์จะนำมาสร้างสรรค์ให้สวยงามครับ เช่น ลวดลายที่สวยงามที่มีอยู่บนเปลือกหอย ถือเป็นความงามที่มีอยู่ตามธรรมชาติ ยังไม่ถือว่าเป็นศิลปะ แต่กรณีของการนำเปลือกหอยมาประดิษฐ์เป็นโมบาย จึงจะเรียกได้ว่าเป็นงานศิลปะ  และมีประโยชน์ตรงที่ช่วยสร้างสุนทรียภาพทางจิตใจให้กับผู้เสพงานศิลปะ
988,สายการบินนานาชาติญี่ปุ่นคือสายการบินอะไร,"เจแปนแอร์ไลน์, ออลนิปปอนแอร์เวย์ ฯลฯ"
989,ถ้าแอมเวย์เป็นธุรกิจลูกโซ่ แสดงว่าธุรกิจแบบ MLM ก็จัดเป็นธุรกิจลูกโซ่ทั้งหมดใช่ไหม,MLM ย่อมาจาก Multilevel marketing คือการตลาดหลายระดับชั้น อาจเรียกว่า ธุรกิจขายตรง หรือธุรกิจลูกโซ่ ต้องมีการแนะนำต่อกันไปเรื่อย ๆ คนที่มีระดับสูงกว่าจึงจะได้ผลตอบแทน มีลักษณะของพีระมิด แอมเวย์ กิฟฟารีน คังเซนเคนโก ต่างก็เป็นธุรกิจลูกโซ่ ธุรกิจลูกโซ่ในที่นี้ต่างจาก supply chain เพราะสินค้ามิได้ผ่านมาจากต้นสายไปยังปลายสาย และไม่มีการแปรรูป 
990,อยากให้แปลงวันเกิดจีนเป็นไทย3ค่ำเดือน5ปี2500,"3 ค่ำ เดือน 5 จีน พ.ศ.2500  ตรงกับ วันศุกร์ที่ 31 พฤษภาคม, นับแบบไทยเป็น ขึ้น 3 ค่ำ เดือน 7 ปีระกา"
991,"ในประวัติศาสตร์ล้านนามีกษัตริย์ชื่อ""พระเจ้ามูลเมือง""ไหมหรือเป็นเรื่องแต่ง",เป็นแค่เรื่องแต่ง เพราะในประวัติศาสตร์ไทย พม่า หรือแม้แต่ล้านนาเองไม่มีคำว่าเจ้ามูลเมืองปรากฏอยู่เลย
992,องค์กรการไฟฟ้าใดเกิดขึ้นก่อนกันระหว่าง การไฟฟ้าฝ่ายผลิต การไฟฟ้านครหลวง การไฟฟ้าภูมิภาค,การไฟฟ้านครหลวงย่อมเกิดขึ้นก่อนตอนที่เป็นโรงไฟฟ้าวัดเลียบ เพราะไฟฟ้าเข้ามาในประเทศไทยสมัย ร.5 ไฟฟ้าย่อมเข้ามาในพระนครก่อน จึงหามีการไฟฟ้าส่วนภูมิภาคไม่ และสมัยนั้นก็ยังไม่แยกระบบผลิตและระบบจำหน่ายออกจากกัน การไฟฟ้านครหลวงจึงถือกำเนิดก่อน เพียงแต่ใช้ชื่ออื่นในช่วงเริ่มต้น
993,ถ้าเราขุดดินในแนวดิ่งลงไปเรื่อยๆ มีโอกาสเป็นไปได้ไหมครับว่ามันจะไปทะลุที่อื่นครับ สงสัยมานานแล้วครับ ช่วยตอบด้วย,ถ้าดิ่งจริงๆ มันจะเป็นระยะทางยาวมากๆ จนดินจากปากบ่อถล่มลงไป หรือไม่ก็จะไปเจอชั้นหินหลอมเหลวที่อยู่ใต้เปลือกโลก
994,วิวัฒนาการของมนุษย์อยู่ในยุคใด,"วิวัฒนาการของมนุษย์มีอยู่ในทุกยุค เพราะวิวัฒนาการไม่มีวันหยุด ร่างกาย อวัยวะทุกส่วนทำงานและมีการปรับตัวอยู่ตลอดเวลาเพื่อให้สามารถรักษาชีวิตใหอยู่รอดตามสภาพแวดล้อมที่มีการเปลี่ยนแปลงอยู่ตลอดเวลาเช่นกัน แต่เนื่องจากว่าวิวัฒนาการต้องใช้เวลายาวนานมาก ๆ อาจใช้เวลาหลายร้อยจนถึงหลายล้านปีเพื่อที่จะเห็นความแตกต่างของการเปลี่ยนแปลง ตลอดอายุไขของมนุษย์จึงอาจไม่เห็นการเปลี่ยนแปลงใด ๆ เกิดขึ้น แต่ถ้าเกิดการเปลี่ยนแปลงอย่างกะทันหันก็คงจะเรียกว่าการกลายพันธุ์ หลักฐานทางดีเอ็นเอระบุว่ามนุษย์น่าจะเริ่มต้นเมื่อประมาณ 200,000 ปีที่แล้วในแอฟริกา"
995,สีขาวในแผนที่ใช้เป็นสัญลักษณ์อะไร,แต่ละแผนที่จะไม่เหมือนกัน ดังนั้นก็แล้วแต่แผนที่นั้น ๆ จะกำหนดไว้
996,แม่น้ำที่สำคัญในคิวบามีแม่น้ำสายไหนมั่ง ,แม่น้ำ Cauto เป็นแม่น้ำที่ยาวที่สุดในคิวบา ยาว 370 กิโลเมตร
997,สภาพแวดล้อมในโลกมีอุณหภูมิเท่าไร,"แล้วแต่สถานที่ ส่วนอุณหภูมิบนพื้นผิวโลกคือ"
998,ตำแหน่งที่ตั้งของลอนดอนพิกัดภูมิศาสตร์คืออะไร,"ใช้พิกัดภูมิศาสตร์ที่ 51°30'28"" เหนือ 00°07'41"" ตะวันตก "
999,ใครเป็นผู้ค้นพบทวีปเอเชีย,เรื่องเอเชียนี่ ประวัติศาสตร์ไม่น่าระบุไว้ เพราะเป็นทวีปที่ใหญ่สุด และมีคนอาศัยอยู่มาตั้งแต่ยุคที่เริ่มจะมีมนุษย์ครับ
1000,เสมอภาคคืออะไร,เสมอภาค ฝรั่งเศส: Égalité  คือความเท่าเทียมกันตามกฎหมายของปัจเจกชน ความเสมอภาคขึ้นอยู่กับหลักความเที่ยงธรรม ความเท่าเทียมกันในเรื่องสิทธิและหน้าที่ เช่น ความเท่าเทียมในด้านการเสียภาษี การรับใช้ชาติโดยการเป็นทหาร และสิทธิในการออกเสียงเลือกตั้ง
