,inputs,targets
1432,เลี้ยวซ้ายผ่านตลอดได้ทุกที่จริงหรือไม่,"สำหรับการเลี้ยวซ้ายบนท้องถนน สามารถกระทำได้เฉพาะบริเวณที่มีป้ายระบุไว้เท่านั้น โดยทางแยกที่สามารถเลี้ยวได้จะมีอักษรระบุอย่างชัดเจนว่า “เลี้ยวซ้ายผ่านตลอด” อยู่ด้านล่างของป้าย ซึ่งมักจะติดตั้งให้เราสังเกตก่อนที่จะตัดสินใจเลี้ยวซ้าย หากพบเห็นป้ายลักษณะนี้จะสามารถเลี้ยวซ้ายได้โดยไม่ผิดกฎจราจร แต่ถ้าในกรณีที่บางแยกนั้นไม่ได้ระบุไว้ เราจะต้องทำตามสัญญาณไฟจราจรเท่านั้น หากฝ่าฝืนกฎจราจรจะโดนปรับได้ทันที ตามพระราชบัญญัติจราจรทางบก พ.ศ. 2522 และที่แก้ไขเพิ่มเติม มาตรา 140 วรรคสี่ ประกอบประกาศสำนักงานตำรวจแห่งชาติ เรื่อง การกำหนดจำนวนค่าปรับตามที่เปรียบเทียบสำหรับความผิดตามพระราชบัญญัติจราจรทางบก พ.ศ. 2522 พ.ศ. 2563 ผู้ใดฝ่าฝืนหรือไม่ปฏิบัติตามเครื่องหมายจราจรที่ที่ติดตั้งไว้ ต้องระวางโทษปรับตั้งแต่ ๒๐๐  ๕๐๐ บาท"
1433,"หากยืมเงินเกิน 2,000 บาทและมีสัญญาการยืมเงิน แต่ไม่ยอมคืนตามระยะเวลาที่กำหนด สามารถเอาผิดทางกฎหมายได้อย่างไรบ้าง","สำหรับมาตรา 213 แห่งประมวลกฎหมายแพ่งและพาณิชย์ เจ้าหนี้สามารถยื่นฟ้องต่อศาลให้มีคำสั่งบังคับให้ลูกหนี้คืนเงินให้ได้ และในกรณีที่มีการฟ้องร้องต่อศาลเกิดขึ้นแล้ว แต่ลูกหนี้ยังไม่ยอมชำระเงินคืนตามตกลง อีกทั้งยังซ่อนเร้น ขาย หรือโอนย้ายทรัพย์สินของตัวเองไปให้บุคคลอื่น เพื่อเลี่ยงการจ่ายหนี้ อาจมีความรับผิดทางอาญา มาตรา 350 ระวางโทษจำคุกไม่เกิน 2 ปี หรือปรับไม่เกิน 40,000 บาท หรือทั้งจำทั้งปรับ การฟ้องศาลเพื่อเรียกเงินคืนตามสัญญากู้ยืม จะมีอายุความ 10 ปี นับแต่วันที่ถึงกำหนดชำระเงินกู้ยืมคืน แต่หากในสัญญากู้ยืมมีการตกลงกำหนดชำระเงินต้นพร้อมดอกเบี้ยแบบเป็นงวดๆ กรณีนี้จะมีอายุความเพียง 5 ปี"
1434,ปลอมบวชเป็นพระมีโทษอย่างไร,"การปลอมบวชเป็นพระ ถือว่ามีความผิดตามประมวลกฎหมายอาญา มาตรา 208 ที่กำหนดว่า ผู้ใดแต่งกายหรือใช้เครื่องหมายแสดงว่าเป็นภิกษุ สามเณร นักพรตหรือนักบวชในศาสนาใดโดยมิชอบ เพื่อให้บุคคลอื่นเชื่อว่าตนเป็นบุคคลเช่นว่านั้น ต้องระวางโทษจำคุกไม่เกิน 1 ปี หรือปรับไม่เกิน 20,000 บาท หรือทั้งจำทั้งปรับ และพระราชบัญญัติคณะสงฆ์ พ.ศ. 2505 และที่แก้ไขเพิ่มเติม มาตรา 44 ตรี ผู้ใดใส่ความคณะสงฆ์หรือคณะสงฆ์อื่น อันอาจก่อให้เกิดความเสื่อมเสียหรือความแตกแยก ต้องระวางโทษจำคุกไม่เกิน 1 ปี หรือปรับไม่เกิน 20,000 บาท หรือทั้งจำทั้งปรับ"
1437,เทน้ำมันหรือสิ่งปฏิกูลลงท่อระบายน้ำผิดกฎหมายอย่างไร,"ผู้ที่เทน้ำมันหรือสิ่งปฏิกูลลงท่อระบายน้ำ จะมีความผิดตามพระราชบัญญัติรักษาความสะอาดและความเป็นระเบียบเรียบร้อยของบ้านเมือง พ.ศ. 2535 มาตรา 33 วรรคหนึ่ง และมาตรา 57 ที่กำหนดว่า ห้ามมิให้ผู้ใดเทหรือทิ้งสิ่งปฏิกูลมูลฝอย น้ำโสโครก หรือสิ่งอื่นใดลงบนถนนหรือในทางน้ำ หากผู้ใดฝ่าฝืนหรือไม่ปฏิบัติตามมาตรา 33 วรรคหนึ่ง ต้องระวางโทษปรับไม่เกิน 10,000 บาท ในกรณีที่มีผู้แจ้งเบาะแสเมื่อพบเห็นผู้กระทำผิด จะได้รับเงินส่วนแบ่งรางวัลนำจับครึ่งหนึ่งของค่าปรับ"
1438,ถ้าล่าหรือครอบครองตัวเงินตัวทองมีความผิดอย่างไรบ้าง,มีความผิดตามมาตรา 89 และมาตรา 92 แห่งพระราชบัญญัติสงวนและคุ้มครองสัตว์ป่า พ.ศ. 2562 ที่กำหนด ห้ามมิให้ผู้ใดล่าสัตว์ป่าคุ้มครอง หรือซากสัตว์ป่า หากฝ่าฝืนมีความผิด ต้องระวางโทษจำคุกไม่เกิน 10 ปี หรือปรับไม่เกิน 1 ล้านบาท หรือทั้งจำทั้งปรับ และห้ามมิให้ผู้ใดมีไว้ในครอบครองซึ่งสัตว์ป่าคุ้มครอง หรือซากสัตว์ป่า หากฝ่าฝืนมีความผิด ต้องระวางโทษจำคุกไม่เกิน 5 ปี หรือปรับไม่เกิน 5 แสนบาท หรือทั้งจำทั้งปรับ
1439,หากแกล้งพูดว่ามี “ระเบิด” อยู่ในสนามบินหรือเครื่องบินมีความผิดอย่างไรได้บ้าง,"โทษของการพูดว่า “มีระเบิด” พกพามาด้วยในสนามบินนั้น เข้าข่ายความผิดตามพระราชบัญญัติว่าด้วยความผิดบางประการต่อการเดินอากาศ พ.ศ. 2558 มาตรา 22 ผู้ใดแจ้งข้อความหรือส่งข่าวสารซึ่งรู้อยู่แล้วว่าเป็นเท็จ และการนั้นเป็นเหตุหรือน่าจะเป็นเหตุให้ผู้อื่นที่อยู่ในท่าอากาศยาน หรือผู้ที่อยู่ในอากาศยานในระหว่างการบินตื่นตกใจ ผู้กระทำต้องระวางโทษจำคุกไม่เกิน 5 ปี หรือปรับไม่เกิน 200,000 บาท หรือทั้งจำทั้งปรับ หากการกระทำนั้น เป็นเหตุให้เกิดอันตรายต่อความปลอดภัยของอากาศยานในระหว่างการบิน ผู้กระทำต้องระวางโทษจำคุกตั้งแต่ 5  15 ปี หรือปรับตั้งแต่ 200,000  600,000 บาท หรือทั้งจำทั้งปรับ"
1441,ครอบครอง “ไซยาไนด์” โดยไม่ได้รับอนุญาต มีความผิดทางกฎหมายอย่างไร,"“ไซยาไนด์” จัดเป็นวัตถุอันตรายชนิดที่ 3 ตามพระราชบัญญัติวัตถุอันตราย พ.ศ. 2535 และที่แก้ไขเพิ่มเติม มาตรา 23 ประกอบมาตรา 73 “ผู้ใดผลิต นำเข้า ส่งออก หรือมีไว้ในครอบครองซึ่งวัตถุอันตรายชนิดที่ 3 โดยมิได้รับอนุญาต ต้องระวางโทษจำคุกไม่เกิน 2 ปี หรือปรับไม่เกิน 200,000 บาท หรือทั้งจำทั้งปรับ”"
1443,เล่นดอกไม้เพลิง พลุ ประทัด ผิดกฎหมายอย่างไร,"บทลงโทษสำหรับการเล่นพลุ ประทัด ดอกไม้เพลิง จนก่อให้เกิดเสียงดังรบกวนอาจเป็นเหตุรำคาญ ต้องระวางโทษจำคุกไม่เกิน 3 เดือน หรือปรับไม่เกิน 25,000 บาท หรือทั้งจำทั้งปรับตามพระราชบัญญัติการสาธารณสุข พ.ศ. 2535 และที่แก้ไขเพิ่มเติม มาตรา 25 มาตรา 28/1 มาตรา 74"
1444,การขีดเขียนบนโขดหินในเขตอุทยานแห่งชาติ มีความผิดอย่างไร,"การขีดเขียนหิน น้ำตก เข้าข่ายผิดกฎระเบียบการท่องเที่ยวในพื้นที่อุทยานแห่งชาติ ซึ่งนักท่องเที่ยวต้องปฏิบัติตามอย่างเคร่งครัด คือ ห้ามแตะต้องกลุ่มหินต่างๆ ภายในถ้ำ และห้ามขีดเขียน ขูดลบ ขีดฆ่า ทา หรือพ่นสีและแป้ง  หากฝ่าฝืนต้องระวางโทษจำคุกไม่เกิน ๕ ปี หรือปรับไม่เกิน ๕๐๐,๐๐๐ บาท หรือทั้งจำทั้งปรับ"
1448,ซื้องานวิจัยมาใส่ชื่อตนเอง มีความผิดตามกฎหมายอย่างไร,ตามพระราชบัญญัติการอุดมศึกษา พ.ศ. 2562 ห้ามมิให้ผู้ใดรับจ้างหรือรับดำเนินการตามวรรคหนึ่ง เพื่อให้ผู้อื่นนำผลงานนั้นไปใช้ประโยชน์ในการดำเนินการตามวรรคหนึ่ง เว้นแต่เป็นการช่วยเหลือโดยสุจริตตามสมควร มาตรา 77 ผู้ใดฝ่าฝืนมาตรา 70 ต้องระวางโทษจำคุกไม่เกิน 3 ปี หรือปรับไม่เกิน 6 หมื่นบาท หรือทั้งจำทั้งปรับ
1449,การสูบกัญชาในที่สาธารณะมีความผิดตามกฎหมายอย่างไร,"มีความผิดตามตามพระราชบัญญัติการสาธารณสุข พ.ศ. 2535 และที่แก้ไขเพิ่มเติม มาตรา 27 มาตรา 28/1 ประกอบมาตรา 74 ต้องระวางโทษจำคุกไม่เกิน 3 เดือน หรือปรับไม่เกิน 25,000 บาท หรือทั้งจำทั้งปรับ"
1450,ดำน้ำ แต่มีพฤติกรรมทำให้ปะการังเสียหาย มีความผิดอย่างไร,"มีความผิดตามพระราชบัญญัติสงวนและคุ้มครองสัตว์ป่า พ.ศ. 2535 และที่แก้ไขเพิ่มเติม ตามมาตรา 16 ห้ามมิให้ผู้ใดล่า หรือพยายามล่าสัตว์ป่าสงวนหรือสัตว์ป่าคุ้มครอง ผู้ใดฝ่าฝืนต้องระวางโทษจำคุกไม่เกิน 4 ปี หรือปรับไม่เกิน 40,000 บาท หรือทั้งจำทั้งปรับ และยังอาจมีความผิดตามพระราชกำหนดการประมง พ.ศ. 2558 มาตรา 56 มิให้ผู้ใดจับสัตว์น้ำในเขตพื้นที่รักษาพันธุ์สัตว์น้ำตามที่รัฐมนตรีหรือคณะกรรมการประมงประจำจังหวัดโดยอนุมัติรัฐมนตรีประกาศกำหนด ผู้ใดฝ่าฝืน ต้องระวางโทษปรับ ตั้งแต่ 5,000 – 50,000 บาท หรือปรับจำนวน 5 เท่าของมูลค่าสัตว์น้ำที่ได้จากการทำการประมง แล้วแต่จำนวนใดจะสูงกว่า"
1451,รับน้องเกินกว่าเหตุ ผิดกฎหมายอย่างไรบ้าง,"ตามประมวลกฎหมายอาญาอาจมีความผิด มาตรา 309 ข่มขืนใจผู้อื่นให้กระทำการใด หรือจำยอมต่อสิ่งใด โดยทำให้กลัวว่าจะเกิดอันตรายต่อชีวิต ร่างกาย เสรีภาพ ชื่อเสียงหรือทรัพย์สินของผู้ถูกข่มขืนใจนั้นเองหรือของผู้อื่น หรือโดยใช้กำลังประทุษร้ายจนผู้ถูกข่มขืนใจต้องกระทำการนั้น ไม่กระทำการนั้นหรือจำยอมต่อสิ่งนั้น ต้องระวางโทษจำคุกไม่เกิน 3 ปี หรือปรับไม่เกิน 60,000 บาท หรือทั้งจำทั้งปรับ"
1452,เลียนแบบเครื่องหมายการค้าที่จดทะเบียนแล้ว ผิดกฎหมายอย่างไร,"บุคคลใดเลียนแบบเครื่องหมายการค้า เครื่องหมายบริการ เครื่องหมายรับรอง หรือ เครื่องหมายร่วมของบุคคลอื่น ที่ได้จดทะเบียนแล้ว  ในราชอาณาจักร เพื่อให้ประชาชนหลงเชื่อว่าเป็นเครื่องหมายการค้า เครื่องหมายบริการ เครื่องหมายรับรอง หรือเครื่องหมายร่วมของบุคคลอื่นนั้น ต้องระวางโทษจําคุกไม่เกิน 2 ปี หรือปรับไม่เกิน 200,000 บาท หรือทั้งจําทั้งปรับ ตามพระราชบัญญัติเครื่องหมายการค้า พ.ศ. 2534 และที่แก้ไขเพิ่มเติม มาตรา 109"
1453,ขายของออนไลน์ “ไม่แจ้งราคา” มีความผิดอย่างไร,"มีความผิดตามประกาศคณะกรรมการกลางว่าด้วยราคาสินค้าและบริการ ฉบับที่ 70 พ.ศ. 2563 มีโทษปรับไม่เกิน 10,000 บาท"
1454,ผลไม้ข้างบ้านล้ำเข้ามาในเขตบ้านเรา เก็บกินได้หรือไม่,เก็บกินไม่ได้ เพราะไม่ใช่ของเรา ถ้าตัดหรือเก็บมา อาจมีความผิดอาญาฐานลักทรัพย์ได้
1455,วัยรุ่นจะได้อะไรจากกฎหมายป้องกันและแก้ไขปัญหาท้องในวัยรุ่น,"เด็กและเยาวชนจะได้รับสิทธิประโยชน์ 7 เรื่องที่สำคัญ"
1457,พฤติกรรมกลั่นแกล้งและดูถูกผู้อื่น ผ่านทางสื่อสังคมออนไลน์ หรือ Cyberbullying มีความผิดตามกฎหมายอย่างไรบ้าง,"การกระทำดังกล่าว หากสามารถระบุตัวบุคคลที่ถูกกล่าวถึงได้ว่าเป็นใคร แม้ไม่ได้เอ่ยชื่อ  อาจจะเข้าข่ายความผิดฐานหมิ่นประมาทตามประมวลกฎหมายอาญา มาตรา 326 และมาตรา 328 มีโทษจำคุกไม่เกิน 1 ปี ปรับไม่เกิน 20,000 บาท หรือทั้งจำทั้งปรับ ซึ่งเป็นความผิดต่อส่วนตัว ผู้เสียหายจะต้องมาร้องทุกข์กับพนักงานสอบสวนเพื่อให้ดำเนินคดีกับผู้กระทำความผิดต่อไป"
1458,ผลิตอาหารไม่ได้มาตรฐาน ไม่ขออนุญาต หรือปนเปื้อนผิดกฎหมายอย่างไร,"การผลิตอาหารที่ไม่ได้มาตรฐานหรือมีการปนเปื้อนสารพิษ อาจทำให้ผู้ที่กินเข้าไปเจ็บป่วย หรือเสียชีวิตได้ โดยเฉพาะอาหารที่มีการแปรรูปต่างๆ หากเจ้าของกิจการละเลยและทำในสิ่งที่ไม่ถูกต้อง อาจมีความผิดตาม พระราชบัญญัติอาหาร พ.ศ. 2522 และที่แก้ไขเพิ่มเติม "
1460,หากผู้ขับขี่รถไม่หยุดรถให้ผู้ข้ามทางม้าลาย มีความผิดอย่างไรบ้าง,"กรณีไม่หยุดรถให้คนข้ามทางม้าลาย โดยมีโทษปรับสูงสุดไม่เกิน 4,000 บาท จากเดิม 1,000 บาท  และตัดคะแนนใบขับขี่ทันที 1 คะแนน "
1461,ร้านขายยาหากไม่มีเภสัชกรประจำร้านจะมีความผิดอย่างไรบ้าง,"มีโทษปรับ 1,000  5,000 บาท ตามมาตรา 29, 39 และ 109 แห่งพระราชบัญญัติยา พ.ศ.2510 และที่แก้ไขเพิ่มเติม"
1462,เพื่อนยืมเงินเพื่อนสามารถทวงหนี้ได้ไม่จำกัดใช่หรือไม่,ใช่ กรณีเพื่อนยืมเงินเพื่อนไม่อยู่ภายใต้กฎหมายการทวงถามหนี้ พ.ศ.2558 เพื่อนสามารถจะทวงหนี้เพื่อนวันละกี่คระเงก็ได้ โดยห้ามแจ้งหรือเปิดเผยเกี่ยวกับความเป็นหนี้ของลูกหนี้ให้แก่ผู้อื่นที่ไม่เกี่ยวข้องกับการทวงถามหนี้ หากฝ่าฝืนต้องระวางโทษจำคุกไม่เกิน 1 ปีหรือปรับไม่เกิน 1 แสนบาทหรือทั้งจำและปรับ
1467,โทรศัพท์ก่อกวนหมายเลขฉุกเฉินมีความผิดอย่างไรบ้าง,"ต้องระวางโทษจำคุกไม่เกิน 1 เดือน หรือปรับไม่เกิน 10,000 บาท หรือทั้งจำทั้งปรับตามพระราชบัญญัติองค์กรจัดสรรคลื่นความถี่และกำกับการประกอบกิจการวิทยุกระจายเสียง วิทยุโทรทัศน์ และกิจการโทรคมนาคม ฉบับที่ 3  พ.ศ. 2562 มาตรา 34/5"
1469,ดักรับข้อมูลคอมพิวเตอร์มีความผิดอย่างไร,"มีความผิดตามมาตรา 8 ของ พ.ร.บ. ว่าด้วยการกระทำความผิดเกี่ยวกับคอมพิวเตอร์ พ.ศ. 2550 โดยมีโทษจำคุกไม่เกิน 3 ปี ปรับไม่เกิน 60,000 บาท หรือทั้งจำทั้งปรับ"
1470,เผาขยะสร้างความเดือดร้อนรำคาญ มีความผิดทางกฎหมายอย่างไร,"ตามพระราชบัญญัติการสาธารณสุข พ.ศ. 2535 และที่แก้ไขเพิ่มเติม มาตรา 25 และประมวลกฎหมายอาญา มาตรา 220 ต้องระวางโทษจำคุกไม่เกิน 7 ปี และปรับไม่เกิน 140,000 บาท"
